<?xml version="1.0" encoding="UTF-8"?>
<!DOCTYPE biblioteca SYSTEM "ejercicio2.dtd">
<biblioteca>
    <usuarios>
        <usuario id="u001">
            <nombre>Ana Pérez</nombre>
        </usuario>
        <usuario id="u002">
            <nombre>Carlos Ruiz</nombre>
        </usuario>
    </usuarios>
    <libros>
        <libro id="b001" formato="epub" estado="disponible">
            <titulo>Cien Años de Soledad</titulo>
            <autor>Gabriel García Márquez</autor>
        </libro>
        <libro id="b002" estado="prestado" prestadoA="u001">
            <titulo>1984</titulo>
            <autor>George Orwell</autor>
        </libro>
        <libro id="b003" estado="reservado" reservadoA="u002">
            <titulo>El Principito</titulo>
            <autor>Antoine de Saint-Exupéry</autor>
        </libro>
    </libros>
</biblioteca>
